{
  "schema_version": 1,
  "operation_id": "capture:exp1",
  "experience_id": "exp1",
  "actor": {
    "id": "candidate-model",
    "kind": "MODEL",
    "version": "synthetic-v1"
  },
  "at": "2026-09-10T12:00:00Z",
  "observation": {
    "kind": "EXTERNAL_RECORD",
    "execution": null,
    "summary": "A synthetic model interpretation needs human review.",
    "outcome": "UNKNOWN",
    "check_refs": []
  },
  "family_id": "speed-fixture-family",
  "sensitivity": "ORDINARY",
  "evidence": [
    {
      "id": "e1",
      "kind": "REFERENCE",
      "author": {
        "id": "operator-1",
        "kind": "HUMAN",
        "version": "local-review-v1"
      },
      "recorded_at": "2026-09-10T12:00:00Z",
      "media_type": "text/plain",
      "sha256": "b8d2d66886fbf4b96e6a6a29e1df80835f1756a3b7b48be28ce50f0f5abb748c",
      "content": "Synthetic fixture: speed is 10 m/s.",
      "generator": null,
      "parent_source_ids": [],
      "rights_note": "Self-authored synthetic software-test material. Not personal data."
    }
  ],
  "statement": {
    "text": "The speed might be 10 km/h. This is an inference.",
    "uncertainty": "HIGH",
    "support_ids": [
      "e1"
    ]
  }
}
